[  
{
  "id": "example_254",
  "name": "Example",
  "category": "None",
  "pitch": 2.54,
  "color": "#a060c0",
  "throughPins": [
    { "col": 0, "row": 0, "label": "1" },
    { "col": 0, "row": 2, "label": "3" },
    { "col": 1, "row": 1, "label": "3" }
  ],
  "features": {
    "copper": [
      { "type": "pad", "x": 1, "y": 1.5, "w": 1.475, "h": 0.4 },
      { "type": "pad", "x": 1, "y": 3.6, "w": 1.475, "h": 0.4 }
    ],
    "mask": [
      { "type": "pad", "x": 1, "y": 1.5, "w": 1.575, "h": 0.5 },
      { "type": "pad", "x": 1, "y": 3.6, "w": 1.575, "h": 0.5 }
    ],
    "silk": [
      {
        "type": "poly",
        "points": [
          { "x": 1, "y": 0 },
          { "x": 3, "y": 0 }
        ]
      },
      {
        "type": "poly",
        "points": [
          { "x": 1, "y": 6 },
          { "x": 3, "y": 6 }
        ]
      },
      { "type": "circle", "x": 0.7, "y": 2, "d": 0.25 }
    ],
    "drills": [
      { "x": 2.5, "y": 1, "drill": 0.3, "size": 0.6 },
      { "x": 2.5, "y": 4.5, "drill": 0.3, "size": 0.6 }
    ],
    "silkText": [
      { "type": "text", "text": "1", "x": 1.6, "y": 0.5, "height": 0.9, "rotation": 0 },
      { "type": "text", "text": "2", "x": 0, "y": 2.5, "height": 0.9, "rotation": 0 },
      { "type": "text", "text": "3", "x": 1.6, "y": 5, "height": 0.9, "rotation": 0 }
    ]
  },
"optionalFeatures": {
    "copper": [         ],
    "copperBack": [
    { "type": "pad", "x": 1, "y": 1, "w": 2, "h": 4 }
    ],
    "drills": [
    { "x": 1, "y": 2.54, "drill": 0.3, "size": 0.6 }
    ],
    "mask": [
        { "type": "pad", "x": 1, "y": 3.6, "w": 1.575, "h": 0.5 }
    ]
  },
  "outline": { "width": 4.5, "height": 9.6 },
  "outlineOffset": { "x": 0, "y": 0 },
  "widthPins": 2,
  "heightPins": 4,
  "silkLabel": { "text": "Example", "rotation": 0, "x": 1.12, "y": 6.7, "height": 0.8 },
  "overlay": false
}
]
